{
  "schema_version": "1.0",
  "app": "just-fix-the-position",
  "_instructions_for_llm": "Use este JSON como contrato visual e comportamental. Preserve layout e implemente a interação de modal.",
  "llm_brief": {
    "goal": "Recriar uma tela com botão que abre um modal de confirmação.",
    "project_name": "Modal Interaction Fixture",
    "export_mode": "screen",
    "target_profile": "html-css",
    "implementation_priority": [
      "Preserve the button and modal positions.",
      "Implement the click interaction described in interaction_summary.",
      "Use hidden/visible state for the modal target."
    ],
    "coordinate_system": { "origin": "top-left", "unit": "px", "canvas_width": 960, "canvas_height": 640, "total_height": 640, "z_order": "Higher layer_order renders above lower layer_order." },
    "screen_summary": "Small desktop screen with a primary button and an initially hidden confirmation modal.",
    "layout_rules": [
      "The modal should render above the page when opened.",
      "The modal overlay may be generated by code if needed, but the modal panel bounds must be preserved."
    ],
    "visual_hierarchy": [
      { "level": 1, "id": "modal", "name": "Confirm Modal", "role": "modal", "component": "ConfirmDialog", "bounds": { "left": 300, "top": 170, "right": 660, "bottom": 410 }, "layer_order": 200 },
      { "level": 2, "id": "open-button", "name": "Open Modal Button", "role": "button", "component": "OpenModalControl", "bounds": { "left": 96, "top": 96, "right": 256, "bottom": 144 }, "layer_order": 100 }
    ],
    "component_plan": [
      { "name": "OpenModalControl", "source": "component_name", "element_ids": ["open-button"], "element_names": ["Open Modal Button"], "suggested_output": "Create a button that controls modal visibility." },
      { "name": "ConfirmDialog", "source": "component_name", "element_ids": ["modal", "modal-title", "modal-copy", "modal-confirm"], "element_names": ["Confirm Modal", "Modal Title", "Modal Copy", "Modal Confirm"], "suggested_output": "Create a dialog/modal component." }
    ],
    "interaction_summary": [
      { "element_id": "open-button", "event": "click", "expected_behavior": "Show Confirm Modal.", "swap_with": { "element_id": "modal", "name": "Confirm Modal", "type": "shape" } }
    ],
    "timeline_summary": [{ "instruction": "No timeline is active; render the static layout and implement interaction state." }],
    "ambiguities": ["Modal starts with visible=false; use it as hidden initial state."],
    "final_instruction": "Return a faithful implementation with working modal open behavior."
  },
  "exported_at": "2026-07-25T00:00:00.000Z",
  "export": { "type": "screen", "name": "Modal Interaction Fixture", "profile": "html-css", "interface_language": "pt" },
  "canvas": { "type": "desktop", "width": 960, "height": 640, "total_height": 640, "screens": [{ "name": "Tela 1", "type": "page", "width": 960, "height": 640 }], "guides": { "h": [], "v": [] }, "color_vars": [{ "name": "brand-red", "value": "#ff3033" }, { "name": "ink", "value": "#111517" }] },
  "assets": [],
  "elements": [
    { "id": "open-button", "name": "Open Modal Button", "type": "shape", "semantic_role": "button", "component_name": "OpenModalControl", "position": { "x": 96, "y": 96 }, "size": { "width": 160, "height": 48 }, "bounds": { "left": 96, "top": 96, "right": 256, "bottom": 144, "center_x": 176, "center_y": 120 }, "rotation": 0, "layer_order": 100, "opacity": 1, "visible": true, "locked": false, "constraints": { "x": "left", "y": "top" }, "states": { "normal": true, "hover": true }, "text": { "content": "Open modal", "font_family": "system-ui", "font_size": 16, "font_weight": "700", "font_color": "#ffffff", "text_align": "center" }, "shape": { "variant": "button", "style": { "background": "#ff3033" } } },
    { "id": "modal", "name": "Confirm Modal", "type": "shape", "semantic_role": "modal", "component_name": "ConfirmDialog", "position": { "x": 300, "y": 170 }, "size": { "width": 360, "height": 240 }, "bounds": { "left": 300, "top": 170, "right": 660, "bottom": 410, "center_x": 480, "center_y": 290 }, "rotation": 0, "layer_order": 200, "opacity": 1, "visible": false, "locked": false, "constraints": { "x": "center", "y": "center" }, "states": { "normal": true }, "description": "Hidden initially. Show when Open Modal Button is clicked.", "text": { "content": "", "font_family": "system-ui", "font_size": 16, "font_weight": "400", "font_color": "#111517", "text_align": "left" }, "shape": { "variant": "modal", "style": { "background": "#ffffff" } } },
    { "id": "modal-title", "name": "Modal Title", "type": "text", "semantic_role": "heading", "component_name": "ConfirmDialog", "position": { "x": 324, "y": 198 }, "size": { "width": 260, "height": 32 }, "bounds": { "left": 324, "top": 198, "right": 584, "bottom": 230, "center_x": 454, "center_y": 214 }, "rotation": 0, "layer_order": 210, "opacity": 1, "visible": false, "locked": false, "constraints": { "x": "center", "y": "center" }, "states": { "normal": true }, "text": { "content": "Confirm action", "font_family": "system-ui", "font_size": 22, "font_weight": "800", "font_color": "#111517", "text_align": "left" } },
    { "id": "modal-copy", "name": "Modal Copy", "type": "text", "semantic_role": "text", "component_name": "ConfirmDialog", "position": { "x": 324, "y": 246 }, "size": { "width": 288, "height": 52 }, "bounds": { "left": 324, "top": 246, "right": 612, "bottom": 298, "center_x": 468, "center_y": 272 }, "rotation": 0, "layer_order": 211, "opacity": 1, "visible": false, "locked": false, "constraints": { "x": "center", "y": "center" }, "states": { "normal": true }, "text": { "content": "This modal appears when the user clicks the primary button.", "font_family": "system-ui", "font_size": 15, "font_weight": "400", "font_color": "#455053", "text_align": "left" } },
    { "id": "modal-confirm", "name": "Modal Confirm", "type": "shape", "semantic_role": "button", "component_name": "ConfirmDialog", "position": { "x": 500, "y": 340 }, "size": { "width": 112, "height": 40 }, "bounds": { "left": 500, "top": 340, "right": 612, "bottom": 380, "center_x": 556, "center_y": 360 }, "rotation": 0, "layer_order": 212, "opacity": 1, "visible": false, "locked": false, "constraints": { "x": "center", "y": "center" }, "states": { "normal": true, "hover": true }, "text": { "content": "Confirm", "font_family": "system-ui", "font_size": 15, "font_weight": "700", "font_color": "#ffffff", "text_align": "center" }, "shape": { "variant": "button", "style": { "background": "#111517" } } }
  ],
  "interactions": [
    { "element_id": "open-button", "event": "click", "description": "Show Confirm Modal.", "swap_with": { "element_id": "modal", "name": "Confirm Modal", "type": "shape" } }
  ],
  "components": [],
  "timeline": { "active": false },
  "warnings": []
}
